Price,Star_Rating,Reviews,Product_Description,Tipo
3.9,4.3,515,"Himalaya Deep Cleansing Coffee Face Scrub con café y canela para una piel suavemente exfoliada y purificada con un brillo radiante y sin grasa, 75ml Acerca de este producto                         El Exfoliante Facial de Café de Limpieza Profunda de Himalaya, con su combinación orgánica de Café y Canela, es perfecto para exfoliar y purificar suavemente la piel, dejándola radiante y libre de grasa.     Himalaya Deep Cleansing Coffee Face Scrub exfolia para revelar un aspecto radiante y libre de grasa y limpia en profundidad sin resecar la piel.     Café verde - antioxidante natural - protege la piel de los radicales libres, ayuda a mejorar la textura y el tono de la piel proporcionando un aspecto enérgico y radiante.     Café tostado - exfoliante y antioxidante natural - ayuda a estimular la circulación de la piel, lo que contribuye a un aspecto más radiante y fresco.     Canela - naturalmente rica en polifenoles - protege la piel de los factores ambientales externos como la suciedad, el polvo, la contaminación y el aceite y proporciona una sensación energizante                              Ver más detalles Descripción del productoEl exfoliante facial energizante e iluminador combina café de cultivo ecológico (una mezcla de café tostado y verde) y canela para exfoliar suavemente y limpiar la piel en profundidad todos los días. Limpia, refresca y reduce el exceso de grasa para conseguir una piel radiante, y su aromático aroma a café recién tostado proporciona una experiencia refrescante y energizante.IngredientesAqua, Alcohol, Porvinylcohol, PEG-32, Propylene Glycol Phenoxyethanol, Fragrance, PanasoSativus Fruit Extract, Prunus Amygdalus Dulcis Seed Extract, Cucumis Sativus Fruit Extract, Xanthan Gum, Sodium Benzoate, CI 77891 & Mica, Emblica Officinalis Fruit Extract, C19140 & CI 42090.direcciónAplicar una pequeña cantidad de exfoliante sobre el rostro y el cuello con movimientos circulares, evitando el contorno de los ojos. Masajear suavemente con las yemas de los dedos durante un minuto. Lavar y secar. Utilizar 2-3 veces por semanaAdvertencia de seguridadAlmacenar en un lugar fresco y seco, alejado del calor y la luz solar.Ver más",exfoliante
3.98,4.7,74,"Ziaja Natural Care - Exfoliante facial (70 ml) Acerca de este producto                         Exfolia suavemente y nutre la piel durante la limpieza. Suaviza visiblemente.     99% de ingredientes de origen natural veganos.     Aplicar sobre la piel seca o húmeda. Masajea con movimientos circulares. Evita el área de los ojos. Enjuagar con agua tibia. Uso diario o 2-3 veces a la semana.     Exfoliante facial cremoso de grano fino.     Es perfecto para el cuidado, higiene y acondicionamiento diario de la piel.     Deja una agradable y delicada fragancia que suaviza la piel y la prepara para los tratamientos posteriores.                              Ver más detalles ",exfoliante
13.99,4.2,672,"Acido Salicilico y Aloe Vera 100ml, BHA Exfoliante Facial - Contra Puntos Negros, Desobstruye Poros, Imperfecciones y Manchas de Acne - Hidrata y Nutre Cara y Contorno de Ojos - Satin Naturel 🍃 PEELING FACIAL BIO CON ACIDO SALICILICO - El BHA (Acido Salicilico) regula el exceso de sebo y ayuda a reducir puntos negros, rojeces, imperfecciones y manchas en la cara y contorno de ojos. Con un efecto exfoliante y suavizante inmediato. Este peeling facial ofrece una suave acción exfoliante para eliminar impurezas y granos, a la vez que favorece un cutis radiante. Perfecto para la piel grasa y mixta.     🍃 FORMULACIÓN ÚNICA E INNOVADORA: Nuestro peeling facial BHA es el primero en combinar los beneficios del ácido salicílico y el aloe vera orgánico en una fórmula natural. Mima tu piel con una experiencia de cuidado excepcional y redescubre una piel radiantemente bella. Perfecto para uso con dermaroller.     🍃 EXFOLIACIÓN SUAVE CON ALOE VERA CALMANTE: Enriquecido con aloe vera orgánico, este peeling BHA ofrece propiedades calmantes e hidratantes para la piel, minimizando la irritación potencial causada por la exfoliación. Gracias a su fórmula suave, este exfoliante facial es adecuado para todo tipo de pieles, incluidas las sensibles. Consigue una exfoliación eficaz sin dañar tu piel.     🍃 BIO, VEGANO Y SIN CRUELDAD - Todos nuestros productos se fabrican en Alemania siguiendo los más altos estándares de calidad. Trabajar estrechamente con nuestros proveedores locales significa que podemos promover canales de distribución cortos mientras te ofrecemos la mejor calidad y respetamos nuestro planeta.     🍃 ESTAMOS AQUÍ PARA USTED - Impulsados por su satisfacción, nos esforzamos por crear productos excelentes. Si tiene alguna pregunta, no dude en ponerse en contacto con nuestro equipo. ¡Queremos que seas feliz! Le devolvemos su dinero. Date un capricho a ti mismo y a nuestro planeta. ¡Elija Natural Satin!                              Ver más detalles ",exfoliante
19.97,4.0,8,"LEHMAN | Exfoliante Facial Hombre Premium 30ml | Limpieza Profunda | Carbón Activo, Partículas Naturales de Coco | Combate Puntos Negros, Poros Dilatados y Acné | Fabricado en España Acerca de este producto                         💧 LIMPIEZA PROFUNDA Y RENOVACIÓN TOTAL: Nuestro exfoliante facial para hombre ha sido diseñado para limpiar en profundidad y renovar tu piel. Gracias al carbón activo y las partículas naturales de coco, elimina impurezas, toxinas y exceso de grasa acumulada, dejando tu rostro fresco y revitalizado. Su acción exfoliante es perfecta para combatir puntos negros, poros dilatados y espinillas, mientras asegura que la piel mantenga su equilibrio natural. Es el aliado ideal para hombres con piel mixta o grasa que buscan resultados visibles     ☘️ HIDRATACIÓN Y CUIDADO DURANTE LA EXFOLIACIÓN: A diferencia de otros exfoliantes, la fórmula de Lehman incorpora manteca de karité y aceite de chía, que trabajan para nutrir e hidratar la piel mientras eliminan las células muertas. Esto garantiza que tu rostro no solo se sienta limpio, sino también suave, hidratado y cómodo después de cada uso. Es ideal para hombres que quieren una exfoliación efectiva sin comprometer la salud de su piel     🪔 CONTROL DEL SEBO Y TEXTURA PERFECTA: El almidón de arroz regula la producción de grasa en la piel, ayudando a mantener un acabado mate y uniforme. Con su uso regular, verás cómo los poros se minimizan y la textura de tu piel se vuelve más lisa y uniforme. Este exfoliante está pensado para hombres que desean mantener su piel bajo control y con un aspecto impecable durante todo el día     👌 EXPERIENCIA SENSORIAL ÚNICA Y EFICAZ: Con una textura diseñada para maximizar la limpieza y la frescura, este exfoliante se convierte en un imprescindible en tu rutina semanal. Sus pequeñas partículas proporcionan una sensación de limpieza profunda mientras masajeas tu rostro. El aplicador incluido permite una aplicación más precisa y cómoda, asegurando una experiencia profesional desde casa. Una vez aclarado, sentirás tu piel totalmente renovada, limpia y preparada para lo que venga     💚 FABRICADO EN ESPAÑA CON INGREDIENTES NATURALES: Con orgullo desarrollado y fabricado en España, este exfoliante refleja el compromiso de Lehman con la calidad y el respeto al medio ambiente. Su fórmula combina ingredientes naturales como el carbón activo, la manteca de karité y las partículas de coco, ofreciendo resultados visibles sin agresiones para la piel ni el planeta. Perfecto para hombres que valoran un cuidado personal eficaz y sostenible                              Ver más detalles Descripción del productoEl Exfoliante Facial Hombre Premium de Lehman es el compañero perfecto para llevar tu cuidado facial al siguiente nivel. Diseñado para hombres que no dejan nada al azar, este exfoliante combina la eficacia del carbón activo, las partículas de coco y la manteca de karité para limpiar profundamente, renovar tu piel y dejarla con un aspecto fresco y revitalizado. Cada vez que lo uses, sentirás cómo sus partículas trabajan en tu piel, eliminando puntos negros, células muertas e impurezas mientras revitalizan tu rostro. Su fórmula suave pero potente está pensada para adaptarse a ti: puedes aplicarlo directamente con las manos o con el aplicador incluido, disfrutando siempre de una experiencia cómoda y eficaz. La textura cremosa, enriquecida con ingredientes naturales, garantiza que tu piel no solo quede limpia, sino también hidratada y protegida. Su perfume es suave y masculino, diseñado para acompañarte sin ser invasivo, haciendo que cada aplicación sea un momento de cuidado personal único y agradable. Después de enjuagar, notarás cómo tu piel queda increíblemente suave, fresca y completamente renovada, lista para cualquier desafío del día o para recibir el siguiente paso de tu rutina de cuidado facial. Para mantener tu piel en su mejor versión, úsalo una o dos veces por semana y disfruta de una limpieza profunda sin comprometer la suavidad ni la hidratación de tu piel. Con Lehman, no solo limpias tu rostro: lo preparas para lucir su mejor versión. Porque tu piel merece lo mejor, y tú tambiénAdvertencia de seguridadEvitar el contacto con los ojos y mucosas. Uso externo. Mantener fuera del alcance de los niños. No exponer a temperaturas superiores a 35º. Mantener en lugar fresco y seco.",exfoliante
13.25,4.5,1,"Neutrogena Skin Detox exfoliante refinador de la piel, exfoliante de lavado suave con ácido glicólico Acerca de este producto                         Contra el 100% de todos los contaminantes y el impacto ambiental diario, adecuado para todo tipo de piel     Refina el aspecto de la piel y limpia la piel en profundidad, para un cutis radiante     Fácil de usar: aplicar sobre la cara húmeda y masajear suavemente. A continuación, lavar a fondo con agua.     Contenido del envío: 1 exfoliante Neutrogena Deep Clean, 150 ml, número de referencia 9563101                              Ver más detalles Descripción del productoLas micropartículas exfoliantes suaves con ácido glicólico liberan los poros y disuelven suavemente las partículas de suciedad, sebo y maquillaje atrapadas sin atacar el contenido de humedad de la piel. No obstruye los poros. Aplicar sobre la cara húmeda y masajear suavemente. A continuación, lavar a fondo con agua. Evitar el contacto con los ojos. En caso de contacto con los ojos, enjuague bien con agua.IngredientesPR-0019215 Aqua, Sodium C14-16 Olefin Sulfonate, Cocamidopropyl Hydroxysultaine, Cellulose, Sorbitol, Acrylates Crosspolymer-4, Sodium Hydrolyzed Potato Starch Dodecenylsuccinate, Cera Microcristallina, Ácido Salicylic Acid, Disodium Tetrapropene Succinato de ilo, Mentol, polisorbato 20, cloruro de sodio, EDTA de disodio, ácido cítrico, ácido glicólico, hidróxido de sodio, perfume, CI 77510, CI 42053direcciónAplique el producto sobre una cara húmeda, masajee suavemente, luego enjuague bien con agua.Ver más",exfoliante
5.39,4.5,29,"MEN EXPERT PURE CHARCOAL SCRUB 100ML Acerca de este producto                         Cuidado de la piel MEN EXPERT PURE CHARCOAL SCRUB 100ML de LOREAL     Productos de Cuidado de la piel para hombre     Los productos de la marca LOREAL están fabricados con ingredientes de la mejor calidad.                              Ver más detalles Descripción del productoExfoliante facial para hombre. Los Productos de la marca LOREAL están diseñados para cuidarte, mimarte y hacerte sentir bien todos los días de año.IngredientesAqua / Water, Glicerina, Ácido mirístico, Ácido estearic, ácido palmítico, hidroxido de potasio, ácido lírico, glicol, sorbitol, estearato de glicerilo, Peg-8, perlita, extracto de menta piperita/extracto de menta de pimienta, polvo de carbón, Caprilyl Glycol, Tetrash odio Edta, Aa Ciric, Pentylene Glycol, Polyglycerin-10, Polyglyceryl-10 Myristate, Polyglyceryl-10 Stearate, Polyquaternium-4, Sodium Dehidroacetato, Phenoxyethanol, Ci 77499/Iron Oxides, Líneas AlAlAlAlAlAlAle, Parfum/Fragrance. (F.I.L. B228149/1).direcciónAplicar sobre el rostro y el cuello mojados masajeando suavemente y luego enjuague con agua tibia. Aplique exfoliante contra puntos negros todas las mañanas y noches. Evitar el contorno de los ojos. En caso de contacto con los ojos, enjuagar inmediatamente con abundante agua.Advertencia de seguridadSolo para uso externoVer más",exfoliante
27.99,4.4,65,"Siwon - Coffee Crush | Exfoliante Facial Anti Puntos Negros y Granitos con Ácido salicílico | Energizante Mañanero | Efecto Mate | Limpieza Profunda, 200g Limpieza facial hombre. Cuidado facial hombre Acerca de este producto                         ⚡ Chute energético mañanero: el día se te puede complicar, pero al menos lo empiezas con energía y buena cara. Coffee Crush de Siwon es un exfoliante facial con ácido salicílico que te da un chute de energía cada mañana. ¡Es como tomar tu café favorito, pero para tu piel!     🤩 ¿Piel suave como un melocotón? ¡Sí, por favor! Carita como el cemento pulido: ni un grano, ni un brillo... mate mate como la piel de un melocotón. Este exfoliante facial no solo limpia en profundidad y desatasca los poros, sino que también suaviza e hidrata tu piel.     👋 ¡Adiós a los puntos negros y granitos! Este exfoliante lucha contra las impurezas pero sin resecar la piel y sin que se te caiga a tiras. Y lo mejor de todo, es que deja un efecto mate en tu piel. ¡Ni un grano, ni un brillo!     ⏱️Hack: déjalo actuar 5-10 minutos como una mascarilla para potenciar sus efectos. ¡Es un exfoliante y una mascarilla en uno!     🌿Cruelty-free y vegano. No lleva parabenos ni sulfatos. Este producto es vegano y libre de parabenos y sulfatos. Así que no solo estás cuidando tu piel, sino también el planeta. Está testado dermatológicamente.                              Ver más detalles ",exfoliante
4.75,4.0,118,"Himalaya Exfoliante Facial Cúrcuma Antimanchas, Exfolia y Mejora la Textura de la Piel, 75ml Acerca de este producto                         PIEL MÁS CLARA DESPUÉS DEL 1ER USO; EXFOLIA; MEJORA LA TEXTURA DE LA PIEL     CÚRCUMA PRENSADA EN FRÍO, DE ORIGEN ORGÁNICO; 97% de ingredientes de origen natural; 100% reciclable; clínicamente testado.     PHYTO VITAMIN COMPLEX - sinergia de CURCUMA, REGALIZ y NIACINAMIDA para maximizar el efecto iluminador de la piel     TODOS LOS TIPOS DE MANCHAS OSCURAS: manchas solares, manchas de envejecimiento, manchas postacné     Fórmula ligera, de rápida absorción y que no mancha.                              Ver más detalles Descripción del productoHimalaya Dark Spot Clearing Curcuma Face Scrub es una fórmula única que aprovecha el poder de la cúrcuma, un remedio natural de eficacia probada para los problemas de la piel. El regaliz y los exfoliantes naturales de celulosa eliminan la suciedad, las impurezas y las células muertas de la piel, reduciendo las manchas y dejando la piel suave, luminosa y radiante.IngredientesAqua, Stearic Acid, Glycerin, Caprylic/Capric Triglyceride, Cetyl Alcohol, Microcrystalline Cellulose, Sorbitan Stearate, Curcuma Longa Rhizome Extract, Phenoxyethanol, Niacinamide, Parfum, Carbomer, Sodium Hydroxide, Benzyl Alcohol, Sucrose Cocoate, Ethylhexylglycerin, Disodium EDTA, CI 11680, Glycyrrhiza Glabra Root Extract, CI 73360, Tocopheryl Acetate, CI 19140, CI 15985, LinalooldirecciónAplicar una pequeña cantidad del exfoliante sobre la piel humedecida de la cara y el cuello. Masajear suavemente con movimientos circulares, evitando el contorno de los ojos. Aclarar abundantemente con agua.Advertencia de seguridadConservar en lugar fresco y seco, a menos de 25 °C. Sólo para uso externo.Ver más",exfoliante
17.99,3.9,191,"ACWOO Peeling Ultrasónico Facial, 4 en 1 Espatula para Limpieza Facial, Skin Scrubber, Limpiador Facial Ultrasónico, Depurador de Piel, Exfoliación Facial Limpiador de Poros y Puntos Negros (Verde) Acerca de este producto                         【Cómodo y limpio】El limpiador ultrasónico de la piel con vibración de alta frecuencia de 20.000 veces/s por segundo y puede limpiar profundamente los poros, la piel muerta y otra suciedad. Los espatula ultrasonica no dañan la piel, son un tratamiento suave e indoloro para el acné, el tratamiento de arrugas, el lifting facial y la piel con muchos callos. Y ayuda a la piel a absorber nutrientes y la hace radiante, brillante y elástica.     【Piel suave】 Se estimula el flujo linfático, la circulación de la piel se vuelve más eficiente y los residuos se eliminan suavemente. Esto reduce las arrugas iniciales y elimina las imperfecciones. La piel se vuelve más suave y parece más joven.     【Diseño único】 Diseño de raspador único, hecho de acero inoxidable, seguro de usar, cóncavo para adaptarse a los contornos de la cara, esquinas suaves y redondeadas para adaptarse completamente a la posición de la nariz.     【4 modos de funcionamiento】Modo ""Peel"", limpia los poros obstruidos y los puntos negros (este paso requiere mantener la piel húmeda); modo ""ION+"" para suavizar la queratina vieja, descomponer la melanina y los puntos negros; Modo ""ION-"" para acelerar la absorción de nutrientes, promover el metabolismo de la piel y reducir las arrugas; Aplicar la crema reafirmante y seleccionar el modo ""Lift"" para levantar y reafirmar la piel.     【Seguro y portátil】 Fácil de transportar, adecuado para viajes y uso diario. Nota: Hidrate la piel antes de usarla o úsela con productos para el cuidado de la piel. El exfoliante ultrasónico tiene función de tiempo y se apaga automáticamente después de 10 minutos. Los skin scrubber le brindan la oportunidad de restaurar una piel hermosa en su piel y son una excelente opción de regalo para sus seres queridos.                              Ver más detalles Descripción del productoCaracterísticas:1. Ritidectomía profunda y mejora de la elasticidad de la piel.2. Promueve la circulación sanguínea y el metabolismo linfático.3. Mejorar la capacidad de regeneración y permeabilidad de las células de la piel.4. Masaje cutáneo, introducción a la nutrición y derivación variada.5. Sin daños ni efectos secundarios en la piel.6. Aspecto elegante, fácil de usar, operar y transportar.Operación con un solo botónEl botón único puede satisfacer todas sus necesidades, encendido, apagado y cambio de modo, fácil operación.Carga USBEl limpiador facial ultrasónico viene con un cable de carga USB, puede cargarlo fácilmente en cualquier momento y en cualquier lugar, puede usar un banco de energía, un cargador de teléfono móvil o conectarlo directamente al puerto USB de la computadora para cargarlo.PortátilUsar este limpiador de piel ultrasónico significa que siempre tendrá un salón de belleza a su lado, lo que le permitirá disfrutar del tratamiento facial en cualquier momento y en cualquier lugar.Especificación:Material de la carcasa exterior: ABSCabeza sónica: acero inoxidablePeso: 75gBatería: recargable 500mAhLista de embalaje:Depurador de piel ultrasónico*1Cable de carga USB*1Manual de usuario*1direcciónPaso 1. Lávate la cara con agua tibia o crema para mantener tu piel húmeda. Paso 2. Mantén pulsado el botón durante 3 segundos para encender el dispositivo y selecciona el modo ""Pelar"" para la función de limpieza profunda. Si quieres apagar el dispositivo, también puedes mantener presionado el botón durante 3 segundos. Paso 3. Si necesitas reducir las arrugas, selecciona el modo ""Levantar"" para levantar tu piel. Paso 4. Si quieres que tu piel se vuelva más suave y brillante, selecciona el modo 'Ion+ & Ion-' para ayudar a tu piel a absorber nutrientes. Paso 4. Si quieres apagar el dispositivo, también puedes mantener presionado el botón durante 3 segundos.",exfoliante
24.97,4.0,5,"ANLAN Peeling Ultrasónico Facial Skin Scrubber Exfoliación Limpiador de Poros para Limpieza y Cuidado (Blanco) Acerca de este producto                         Limpiador ultrasónico mejorado: nuestro dispositivo de belleza con 4 funciones, incluyendo limpieza ultrasónica, levantamiento de iones +, iones y EMS, que son eficaces, suaves e indoloros para la limpieza facial, removedor de piel muerta, absorción de nutrientes, removedor de arrugas, antienvejecimiento, estiramiento de la piel, levantamiento facial y adecuado para todo tipo de piel.     Limpieza profunda de la piel: vibración ultrasónica de alta frecuencia de hasta 24000/s y fuerza nano-media eficaz que aumenta el poder de limpieza del dispositivo. El modo 'Ion +' tiene múltiples funciones, incluyendo descomponer la melanina y las pecas, eliminar puntos negros difíciles, envejecimiento del estrato córneo y limpieza de poros, exfoliar células de la piel apagada/muerta, comedones, aceite de piel muerta y polvo de maquillaje, etc. Ahorra tiempo y haz que tu piel se vea más nítida y suave.     Mejor absorción de nutrientes: el modo ""ion"" puede liderar la nutrición rápidamente, mejorar la capacidad de absorción de la piel para evitar el envejecimiento y eliminar arrugas. Esta es nuestra función única a diferencia de otros productos.     ❤ EMS Pulse Lifting Skin-- La función de pulso EMS puede acelerar el metabolismo, renovar las células de la piel, promover la regeneración de colágeno, aliviar la melanina y las arrugas firmes, restaurar la elasticidad, lo que hará que tu piel sea firme, suave y delicada.     ❤Viajes y regalo para mujeres: el limpiador de piel para mujer es un regalo ideal para una madre, esposa, hija, novia, estudiante de regreso a clases, estudiantes de entrevista de graduación para cada festival o cualquier otra ocasión especial. Ofrecemos 12 meses de servicio posventa, si tienes alguna pregunta o cualquier requisito, ponte en contacto con nosotros.                              Ver más detalles ",exfoliante
11.99,4.4,2,"Body Scrub de Australian Bodycare, para hombres y mujeres, 200 ml | Exfoliante con aceite de árbol del té 100% nsatural | Para espinillas en la espalda o en el cuerpo, impurezas y pelos encarnados. Acerca de este producto                         🌿 RESULTADOS: ¿Qué resultados puedo esperar y en cuánto tiempo? Sentirá el efecto inmediatamente, ya que exfolia la piel dejando una sensación de suavidad. Limpia las impurezas y piel muerta y ayuda a prevenir probelmas cutáneos mediante una limpieza profunda. Pero no debe esperar resultados de la noche a la mañana; puede llevar un tiempo. Si después de 2 semanas no ve ningún signo de mejoría, ¡envíenos un correo electrónico y reciba un REEMBOLSO COMPLETO! ¡Sin necesidad de devolver el producto     🌿 MODO DE USO: ¿Con qué frecuencia debo usar Body Scrub? Use Body Scrub 2 o 3 veces por semana. Aplique Body Scrub sobre la piel húmeda y masajee bien, prestando especial atención a las zonas que necesiten más cuidado. Siga con Body Wash y después seque suavemente la piel. Para finalizar, use Body Lotion para una experiencia completa de cuidado de la piel.     🌿 INFORMACIÓN DEL PRODUCTO: Body Scrub ha sido probado dermatológicamente y puede usarse para el cuidado diario de la piel. Contiene cáscara de nuez de sándalo, glicerina, alantoína y aceite de árbol del té australiano 100% natural de calidad farmacéutica. Cada uno de sus ingredientes activos naturales ha sido seleccionado cuidadosamente para cada producto. Todos los productos de Australian Bodycare están probados dermatológicamente y son 100% veganos.     🌿 IDONEIDAD: Adecuado para su uso por ambos sexos. Hemos estado desarrollando productos de calidad superior para el cuidado de la piel y resolución de problemas durante más de 30 años y desarrollamos todos nuestros productos utilizando ingredientes de primera calidad. Con respecto a la calidad, nunca la comprometemos. Nuestros productos son 100% veganos y contienen ingredientes 100% naturales y activos.     🌿 GARANTÍA DE DEVOLUCIÓN DE DINERO del 100%: Australian Bodycare proporciona un reembolso completo dentro de los 180 días, incluido el envío. No se hacen preguntas, y no se necesita retornos. Si no está completamente satisfecho con el producto, le reembolsaremos el precio de compra. ENTREGA: ¿El embalaje es discreto? Sí, el producto se entregará en una caja marrón lisa.                              Ver más detalles ",exfoliante
5.98,4.5,702,"Ziaja Lemon Cake Exfoliante Corporal De Azúcar, color Amarillo, 300 ml Acerca de este producto                         Exfoliante corporal de azúcar con increíble aroma a pastel de limón.     Suaviza la piel gracias a los cristales de azúcar natural.     El refrescante limón y la vainilla dejan la piel suave y deliciosamente perfumada.     Contiene manteca de karité.     Producto apto a partir de 6 años.                              Ver más detalles Descripción del productoExfoliante corporal de azúcar con increíble aroma a pastel de limón. Suaviza la piel gracias a los cristales de azúcar natural. El refrescante limón y la vainilla dejan la piel suave y deliciosamente perfumada. Contiene manteca de karité. Producto apto a partir de 6 años.IngredientesSucrose, Paraffinum Liquidum (Mineral Oil), Cera Microcristallina (Microcrystalline Wax), Cera Alba (Beeswax), Elaeis Guineensis (Palm) Oil, Isopropyl Myristate, PEG-7 Glyceryl Cocoate, Propylene Glycol, Parfum (Fragrance), Cetearyl Alcohol, Butyrospermum Parkii (Shea) Butter, Hydrogenated Castor Oil, Benzotriazolyl Dodecyl p-Cresol, Citral, CI 47005 (D&C Yellow No. 10).direcciónAplicar sobre la piel húmeda y masajear con movimientos circulares. Enjuagar a fondo.Advertencia de seguridadSolo para uso externo.Ver más",exfoliante
