Price,Star_Rating,Reviews,Product_Description,Tipo
6.95,4.4,477,"L'Oréal Men Expert Champú sólido para hombres, jabón XL para limpiar el cuerpo, el cabello y la barba, con complejo de aceite de cedro nutritivo, Barber Club, 1 x 80 g Acerca de este producto                         Champú sólido limpiador y nutritivo para hombres en formato XL para uso prolongado en embalaje reciclable sin plástico     Resultado: hidratación duradera y sensación de piel bien cuidada y suave, limpieza especialmente profunda con aroma masculino de madera de cedro     Aplicación: al ducharse, bañarse o como sustituto del jabón, humedecer, hacer espuma y aplicar la espuma sobre el cabello húmedo y el cuerpo y enjuagar     Producto de cuidado corporal con aceite esencial de madera de cedro, adecuado para todo tipo de pieles, gracias a su bajo valor de pH, complemento perfecto para la rutina de cuidado de Barber Club     Contenido del envío: 1 champú fijo L'Oréal Men Expert Barber Club para cuerpo, cabello, barba y cara, 80 g                              Ver más detalles Descripción del productoEl champú fijo Barber Club de L'Oréal Paris Men Expert se beneficia de todo el cuerpo masculino. El champú sólido en el típico formato de jabón es adecuado para el cabello, la cara, la barba y el cuerpo. Limpia y cuida intensamente gracias a su fórmula con aceite de cedro orgánico y esencial. Además, el champú Solid ofrece un pH bajo, lo que lo hace especialmente suave y adecuado para todos los tipos de piel. Hidrata de larga duración, por supuesto, también. Pero el champú Barber Club Festes no solo es bueno para la piel y el cabello, sino también para el medio ambiente. El formato XL promete un uso prolongado y el embalaje sin plástico es 100% reciclable.Ingredientes727789 02 - Ingredientes: Sodium COCOYL ISETHIONATE • HYDROGENATED VEGETABLE ACEITE • AQUA / WATER • POLYGLYCERYL-4 LAURATE • GLYCERINA • ARGANIA SPINOSA KERNEL • PARFERINA UM / PREGUNTA ANCE • LACTATOS DE MYRISTYL • CEDRUS ATLANTICA BARK OIL • TETRASODIUM GLUTAMATE DIACETATE • BENZYL ALCOHOL • BENZYL SALICYLATE • COUMARIN • EUGENOL • LIMONENO • LINALOOL (F.I.L. C264104/1).direcciónHumedece el cabello y el cuerpo, aplica champú sólido directamente, masajea hasta formar espuma y enjuagar bien.Ver más",champu
11.99,4.2,455,"Störtebekker® Premium Champú sólido Sándalo (1 pc.) – Champú vegano hecho a mano para hombre y mujer – cuidado de ducha perfumado para la piel y el cabello – Champú hidratante sólido Acerca de este producto                         ✓ LIMPIEZA SUAVE Y BÁSICA: los ingredientes altamente nutritivos del champú para cabello sólido limpian el cabello intensamente y lo hacen fácil de peinar y no graso. Perfecto también para cuero cabelludo seco.     ✓ TAMAÑO PRÁCTICO: gracias al tamaño práctico y al diseño cuadrado, nuestro champú para el cabello fijo es ideal para viajes y viajes.     ✓ FÁCIL DE USAR: aplique el jabón de ducha directamente en el cuero cabelludo al ducharse o hacer espuma entre las manos y luego masajear en el cabello. Enjuaga bien el cabello.     ✓ Magnífico fragancia: el champú Störtebekker con sándalo se basa en agradables aromas naturales. Las notas aromáticas de resina y madera de nuestro jabón para el cabello son beneficiosas y relajantes.     Hecho a mano: nuestro champú sólido sin sulfatos parabenos y siliconas se fabrica a mano en una fábrica de jabón en Holanda y está empaquetado sin plástico                              Ver más detalles ",champu
14.99,5.0,12,"Champú Sólido sin Parabenos ni Sulfatos-Vegano Natural Ecológico sin Microplásticos-5 Variedades para todo tipo de Cabello-Pelo-Para Mujeres-Hombres-Niños-Con Aceite (Coco) Acerca de este producto                         TIPO DE CABELLO: Cada tipo de barra de champú contiene ingredientes naturales que son buenos para cada tipos de cabello, Cabellos teñidos, la Barra de Coco. Cabellos grasos, la barra de Eucalipto. Cabellos secos, la barra de Aguacate, Cabellos finos, la barra de Lavanda. Para todos los tipos de pelo la barra 2en1 de Mango. Para los Hombres la especial de Tilo y Aciano     NATURAL Y SIN MICROPLÁSTICOS: Block Zeep es sinónimo de champú natural, vegano y 100 % libre de plástico, ahorra 90 gramos de plástico, que ya no acaba en el mar. Una barra de champú equivale a tres botellas tradicionales, reduciendo así las emisiones de CO2 durante el transporte. Libre de aceite de Palma, está hecha a mano en Europa, elaborada a partir de una combinación de manteca de coco o karité y aceites de diversos productos vegetales, como almendra, aguacate, macadamia, coco y mango.     BIENESTAR PARA TI Y EL PLANETA: Para desengrasar el cabello y la piel, se utiliza sulfatos tóxicos y parabenos que pueden irritar o resecar la piel, eliminando los ácidos grasos naturales de tu pelo y provocando debilidad capilar y caída del cabello. Con Block Zeep, damos un paso hacia la sostenibilidad y la salud. Nuestros productos están cuidadosamente elaborados con ingredientes naturales, son 100% veganos y cosechados éticamente, desde aceites esenciales hasta extractos botánicos. Enviamos la pureza de nuestros ingredientes naturales directamente a tu hogar.     CERTIFICACIÓN CREADLETOCREADLE: es un proceso circular infinito en el que los materiales siempre se pueden reutilizar. Todos los materiales utilizados son inofensivos para el planeta y los residuos son insumos para un nuevo proceso, garantizando una huella ecológica positiva. Nuestros productos son Hechos a mano en Europa, ahorrando hasta un 80% de agua, disminuyendo su peso y volumen, lo que reduce la contaminación de CO2 en el transporte.     NUESTRO EMBALAJE: Certificación FSC, Bosques para todos por siempre. El papel proviene de reciclaje o se fabrica a partir de bosques plantados y aprovechados responsablemente. La tinta utilizada está elaborada sin sustancias nocivas, 100% respetuosa del planeta y biodegradable, además utilizamos energía 100% renovable y el agua residual generada durante la producción es tan limpia que vuelve a ser potable                              Ver más detalles ",champu
11.99,4.4,64,"RAW REVIVAL - Champú solido Romero | Anticaspa + Dermatitis Seborreica | Sin sulfatos ni parabenos | Pelo graso + Equilibrio del pH | Vegano | Ingredientes naturales - 80 gr Acerca de este producto                         EQUILIBRANTE - El champú de romero natural ayuda a regular el cabello graso y a calmar el picor del cuero cabelludo sensible.     LIMPIEZA PROFUNDA – La combinación del aceite de romero y la arcilla blanca ofrece una limpieza profunda al cabello, asegurando el pelo limpio por más tiempo y control de la grasa.     FÁCIL DE LLEVAR - Tamaño perfecto para ser tu champú y jabonera de viaje, es ideal tanto para el gimnasio como para tus aventuras, evitando así cargar con botellas de plástico.     SECADO RÁPIDO - La bolsa de organza permite un secado rápido, ya que puedes colgarlo en cualquier lugar donde estés.     UNISEX - Nuestro champú es ideal para toda la familia, adecuado tanto para mujeres como para hombres y niños.                              Ver más detalles ",champu
11.99,4.4,24,"Störtebekker® Premium Champú sólido Tortuga - Champú vegano hecho a mano para hombre y mujer - cuidado de ducha perfumado para la piel y el cabello - Champú hidratante sólido - Champú Bar 100g Acerca de este producto                         ✓ LIMPIEZA SUAVE Y VERDE: Los ingredientes altamente nutritivos del champú para cabello sólido limpian el cabello intensamente y lo dejan fácil de peinar y no graso. También es perfecto para el cuero cabelludo seco.     ✓ TAMAÑO PRÁCTICO: Gracias a su práctico tamaño y diseño cuadrado, nuestro champú sólido para el cabello es ideal para viajar y para llevar.     ✓ FÁCIL DE USAR: Aplicar el jabón de ducha directamente sobre el cuero cabelludo al ducharse o hacer espuma entre las manos y masajear el cabello. Aclarar bien el cabello.     ✓ FRAGANCIA ENCANTADORA: El champú Störtebekker con la fragancia Tortuga se basa en agradables fragancias naturales y deja un aroma fresco y especiado. Las maravillosas fragancias de nuestro jabón para el cabello son calmantes y revitalizantes.     ✓ HECHO A MANO: Nuestro champú sólido sin sulfatos, parabenos ni siliconas está hecho a mano en una fábrica de jabón de Holanda y se envasa sin plástico.                              Ver más detalles ",champu
11.9,4.0,59,"Champu Solido Piel Sensible Curativo y Calmante 90gr - Champu Natural Sin Sulfatos Ni Parabenos PH Neutro - Aceite de Oliva y Cañamo - Champu Mujer y Hombre, Natural Vegano y Ecologico 🌿 CUIDADO CAPILAR PERSONALIZADO PARA CADA TIPO DE CABELLO: La gama de champús y acondicionadores sólidos BAM & BOO ofrece soluciones adaptadas para cabello normal, graso, seco, sensible e infantil. Cada variante está formulada con ingredientes naturales específicos, proporcionando una limpieza profunda y eficaz sin resecar, manteniendo la vitalidad, frescura y suavidad del cabello.     🛡️ CHAMPU CUERO CABELLUDO SENSIBLE – CURATIVO Y CALMANTE: Formulado para el cuero cabelludo sensible, contiene aceite de oliva y CAÑAMO HEMP para una limpieza suave y calmante. Ayuda a reducir la irritación y a proteger el cuero cabelludo, brindando una experiencia de cuidado reparadora y segura.     🌱 SIN SULFATOS NI PARABENOS NI SILICONAS, CHAMPU PH NEUTRO: BAM & BOO apuesta por una limpieza respetuosa que cuida el cuero cabelludo. Nuestros champús son 100% libres de sulfatos, parabenos y otros químicos agresivos, con un pH neutro que permite un uso seguro y adecuado para el cabello y la piel.     🚿 DURADERO, NATURAL, VEGANO Y ECOLÓGICO: Cada barra de champú ofrece una alternativa duradera y práctica frente a los champús líquidos convencionales. Fabricados con ingredientes de origen vegetal, reducen el uso de plásticos y minimizan el impacto ambiental, siendo una opción responsable y sostenible.     🌎 BAM & BOO: CALIDAD, EXCELENCIA Y COMPROMISO CONTIGO Y LA NATURALEZA: elaboramos nuestros productos en las Islas Azores con ingredientes locales y naturales de máxima calidad. Con mucha dedicación, investigación I+D y esfuerzo hemos desarrollado una gama de productos capilares, corporales y de skincare manteniendo nuestra máxima de continua innovación, excelencia y respeto por el medio ambiente.                              Ver más detalles Descripción del productoDescubre el poder del cuidado natural con la gama de champús y acondicionadores sólidos BAM & BOO, diseñados para proporcionar una experiencia de limpieza y protección adaptada a cada tipo de cabello. Desde nuestras instalaciones en las Islas Azores, desarrollamos productos exclusivos que combinan ingredientes locales y de origen vegetal con el máximo compromiso hacia el respeto medioambiental. En BAM & BOO creemos que el cuidado capilar debe ser eficaz y respetuoso, y por eso ofrecemos soluciones adaptadas para cabello normal, graso, seco, cuero cabelludo sensible e infantil. Cada variante está formulada con componentes naturales específicos como el aceite de oliva, el romero, el carbón activo o el açai, para satisfacer las distintas necesidades del cabello, fortaleciendo, equilibrando, nutriendo y calmando, sin resecar ni agredir el cuero cabelludo. La gama BAM & BOO se distingue por ser 100% libre de sulfatos, parabenos, siliconas y otros aditivos agresivos, con una fórmula de pH neutro que cuida y respeta tanto el cuero cabelludo como el medio ambiente. Estos productos veganos y ecológicos son ideales para el uso diario y ofrecen una limpieza profunda y suave que mantiene la vitalidad y frescura del cabello, protegiéndolo en cada lavado. Además, su formato sólido de 90g garantiza una durabilidad superior a la de los productos líquidos convencionales, facilitando su uso y reduciendo el consumo de plásticos y envases innecesarios. BAM & BOO es una marca comprometida con la calidad y la sostenibilidad. Cada champú y acondicionador refleja nuestra dedicación a la investigación, la innovación y el desarrollo de productos de cuidado capilar, corporal y de skincare que cumplen con los más altos estándares de excelencia. En BAM & BOO, trabajamos para ofrecer productos premium y conscientes, capaces de transformar la rutina diaria en una experiencia de cuidado profundo y respetuoso, inspirada en la naturaleza y en el bienestar del cabello y el cuero cabelludo.direcciónMoje el cabello, haga espuma con el champú sólido, masajee el cuero cabelludo, enjuague y repita si es necesario.",champu
11.99,4.5,121,"Störtebekker® Premium Champú sólido Aloe Vera (1 pc.) – Champú vegano hecho a mano para hombre y mujer – cuidado de ducha perfumado para la piel y el cabello – Champú hidratante sólido Acerca de este producto                         ✓ LIMPIEZA SUAVE Y BÁSICA: los ingredientes altamente nutritivos del champú para cabello sólido limpian el cabello intensamente y lo hacen fácil de peinar y no graso. Perfecto también para cuero cabelludo seco.     ✓ TAMAÑO PRÁCTICO: gracias al tamaño práctico y al diseño cuadrado, nuestro champú para el cabello fijo es ideal para viajes y viajes.     ✓ FÁCIL DE USAR: aplique el jabón de ducha directamente en el cuero cabelludo al ducharse o hacer espuma entre las manos y luego masajear en el cabello. Enjuaga bien el cabello.     ✓ Magnífico fragancia: el champú Störtebekker en la fragancia de aloe vera se basa en agradables aromas naturales. Las maravillosas notas frescas de nuestro jabón para el cabello son calmantes y relajantes.     Hecho a mano: nuestro champú sólido sin sulfatos parabenos y siliconas se fabrica a mano en una fábrica de jabón en Holanda y está empaquetado sin plástico.                              Ver más detalles ",champu
11.99,4.7,4,"Störtebekker® Premium Champú sólido Lavanda - Champú vegano hecho a mano para hombre y mujer - cuidado de ducha perfumado para la piel y el cabello - Champú hidratante sólido - Champú Bar 100g Acerca de este producto                         ✓ LIMPIEZA SUAVE Y VERDE: Los ingredientes altamente nutritivos del champú para cabello sólido limpian el cabello intensamente y lo dejan fácil de peinar y no graso. También es perfecto para el cuero cabelludo seco.     ✓ TAMAÑO PRÁCTICO: Gracias a su práctico tamaño y diseño cuadrado, nuestro champú sólido para el cabello es ideal para viajar y para llevar.     ✓ FÁCIL DE USAR: Aplicar el jabón de ducha directamente sobre el cuero cabelludo al ducharse o hacer espuma entre las manos y masajear el cabello. Aclarar bien el cabello.     ✓ FRAGANCIA ENCANTADORA: El champú Störtebekker con aroma de lavanda se basa en agradables fragancias naturales y evoca la naturaleza y la primavera. Las fragancias maravillosamente suaves y frescas de nuestro jabón para el cabello son calmantes y revitalizantes.     ✓ HECHO A MANO: Nuestro champú sólido sin sulfatos, parabenos ni siliconas está hecho a mano en una fábrica de jabón de Holanda y se envasa sin plástico.                              Ver más detalles ",champu
3.49,4.2,1,"Champú Solido Anticaspa. Pardo Natur | Elimina la descamación | Ingredientes naturales | 60 gr Acerca de este producto                         Champú Solido Anticaspa. Pardo Natur | Elimina la descamación | Ingredientes naturales | 60 gr     Champú sólido perfecto para cabellos con caspa. Su potente acción elimina la descamación y controla la producción de sebo.     Fórmula con ingredientes naturales, vegana, biodegradable, sin parabenos ni siliconas.     Formato sólido y sin plásticos = máximo ahorro y respeto al medio ambiente.     Modo de uso: frota la pastilla por tu cabello y masajea para hacer espuma como harías con tu champú habitual. Aclara con abundante agua y disfruta de un cabello brillante, fortalecido y limpio durante más tiempo.                              Ver más detalles Descripción del productoChampú sólido perfecto para cabellos con caspa. Su potente acción elimina la descamación y controla la producción de sebo.IngredientesChampú solido con formulacion a base de ingredientes naturales. 100% cruelty free. Plastic freedirecciónFrota la pastilla por tu cabello y masajea para hacer espuma como harías con tu champú habitual. Aclara con abundante agua y disfruta de un cabello brillante, fortalecido y limpio durante más tiempo.Advertencia de seguridadSolo para uso externoVer más",champu
14.56,4.8,12,"3 Champú Jengibre orgánico, Champú en jengibre para el crecimiento del cabello, Champú solido jengibre, Champú anticaspa jengibre, Champú anticaída para hombres ujeres Acerca de este producto                         ❤【Barra de champú hecha mano】- Ingredientes de plantas naturales puras y no contiene ingredientes agresivos, es seguro de usar, incluso con pieles sensibles. PH equilibrado y seguro para el cabello tratado. Nuestra fórmula y eficaz hace que nuestros productos sean adecuados para hombres y mujeres.     ❤【Recrecimiento del cabello y anticaspa】- El jabón de jengibre para el cabello hidrata y repara el cabello dañado, estimula el crecimiento del cabello en las áreas calvas. Aumenta el volumen general del cabello. Gran reducción en la caída del cabello y el retroceso de la línea del cabello. Mejora la vitalidad de los folículos pilosos, inhibe el crecimiento de bac-terias dañinas, limpia eficazmente la caspa y mejora la picazón del cuero cabelludo.     ❤【 y brillante】 - La barra de champú de jengibre es rica en aceite de jengibre, que nutre profundamente el cuero cabelludo, promueve la absorción de nutrientes, repara el cabello dañado, lo hace y flexible y mejora la sequedad y el color amarillento del cabello.     ❤【Fácil de usar】 Primero moje el cabello, luego aplique Hair Care Ginger Soap directamente sobre el cabello mojado, masajee suavemente el cuero cabelludo durante -3 minutos, luego enjuague con agua tibia.     ❤【Tamaño】 Tamaño: 6 x 6 cm/2,3 x 2,3 pulgadas, peso: 60 g, es compacto y fácil de transportar, ideal para viajes, viajes de negocios, campamentos y otras actividades al aire libre                              Ver más detalles ",champu
9.49,4.1,1,"Arista Champú Sólido Anticaspa Vegano Ayurveda | Aceite de Árbol de Té, Polvo de Hoja de Neem y Arnica | Sin Sulfatos, Parabenos ni Siliconas Acerca de este producto                         Champú anticaspa – Despídete de la caspa y saluda a un cuero cabelludo, suave y relajado, con este champú sólido de Arista. Formulado para combatir la descamación, el picor y la irritación: sentirás tu pelo mucho más fresco y revitalizado.     Ingredientes ayurvédicos naturales – Enriquecido con aceite de árbol de té, polvo de hojas de neem y extracto de flor de arnica. Combate los hongos, las bacterias y la inflamación que causan la caspa. Aprovecha un remedio ayurvédico natural y disfruta de un pelo sano y vibrante.     Fórmula limpia y saludable – Formulado con ingredientes ayurvédicos naturales, nuestro champú sólido sin sulfatos ni siliconas aporta una solución anticaspa ecológica.     Zero-waste – Ecológico y sin plásticos, este shampoo anticaspa se produce con menos agua y es más ligero y compacto, por lo que reduce las emisiones del transporte.     Autocuidado – Nuestra fórmula desarrollada por expertos produce una densa espuma que limpia en profundidad y elimina completamente los residuos.                              Ver más detalles ",champu
18.98,4.2,570,"Hair Dye Shampoo 3 en 1 Cubre Canas, Brown Hair Dye Shampoo 3 en 1,Hair Color, Champú de Color Para el Cabello Instantáneo,Cobertura De Canas En Minutos para Hombres y Mujeres (Marrón Oscuro) Acerca de este producto                         Hair Dye Champú 3 en 1: a diferencia de los tintes para el cabello convencionales, no solo se puede utilizar como tinte para el cabello (el champú instantáneo cubre las canas en solo 10-15 minutos), sino también como champú y acondicionador. Sin parabenos, sin productos químicos agresivos.     Fácil de usar y consejos: prueba la piel antes del primer uso; 1. Aplica los guantes, aplica nuestro champú de color de pelo sobre el cabello seco. 2. Frota uniformemente durante 5 minutos; 3. Déjalo durante 10-15 minutos (si tu cabello es largo, 20-25 minutos para obtener los mejores resultados, de lo contrario no cubrirá completamente el cabello gris. No dejes más de 30 mins). 4. luego enjuague. Puedes tener un cabello negro brillante natural al instante.     Colorear el cabello en casa: Hair dye, muy conveniente para teñir el cabello en casa. Ahorre tiempo Ahorre dinero. Champú de tinte para cabello gris para hombres y mujeres y barba para hombres. (Se recomienda utilizar champú de color de pelo cada 10 a 15 días para obtener mejores resultados). Deje que el cabello blanco no se vea afectado, restaure inmediatamente el cabello negro, rejuvenezca la juventud, déjese disfrutar del tiempo joven.     Champu Colorante: Nuestro champú colorante para el cabello contiene ingredientes naturales, champú colorante para el cabello, fortalece las fibras capilares de adentro hacia afuera, tiene un efecto reparador efectivo y deja el cabello brillante, suave y liso. Champú de color de pelo sólo cuelga en la superficie de la cáscara del cabello, mucho más seguro para su cabello, así como su piel. No daña el cabello.     Cubre el cabello gris: Cuando tienes una cita, el champú instantáneo puede cubrir tus canas en solo unos minutos. Es eficaz para todos los peinados, cubre eficazmente el cabello blanco, restaura un color negro natural a su cabello, por lo que ya no se verá afectado por el cabello blanco y rejuvenecido. Servicio postventa de alta calidad: si el champú para teñir el cabello no funciona, contáctenos para un reembolso completo                              Ver más detalles ",champu
