Price,Star_Rating,Reviews,Product_Description,Tipo
34.99,4.0,28,"Wiohair 2 Champús Anticaída Forte | Frena la caída y fortalece el cuero cabelludo | Sin sulfatos, sin siliconas, sin parabenos | Para hombres y mujeres | 2 x 150ml Acerca de este producto                         FRENA LA CAÍDA AVANZADA: el champú anticaída de 150ml estimula el crecimiento, frena la caída del cabello en solamente 3 meses gracias a su fórmula natural con células madre vegetales desarrollada por expertos capilares.     CRECIMIENTO DE CABELLO MÁS RÁPIDO: el mejor tratamiento para estimular el crecimiento del cabello, aportar volumen y fuerza. Los resultados son un cabello más saludable y fuerte tanto para mujeres y hombres.     CHAMPÚ 150ml ULTRACONCENTRADO PARA EL CUERO CABELLUDO: 150ml = 30 lavados. No necesitas un champú enorme para que te llegue para todo el cabello. Diluye poca cantidad de champú en agua para cubrir todo el cabello. Tamaño ideal para realizar el tratamiento estés donde estés.     INGREDIENTES NATURALES, SIN SULFATOS, NI PARABENOS, NI SILICONAS: Con activos naturales, bio y ecológicos que consiguen frenar la caída y proteger el cabello e hidratarlo para que esté saludable. Con células madre vegetales y con factores de crecimiento     MÁS EFICAZ QUE EL MINOXIDIL: Con un test de eficacia Wiohair demostró tener un 93% de efectividad frente al 57% del Minoxidil. Eso es gracias a la fórmula ultraconcentrada de Células madre y Factores de Crecimiento, los únicos nutrientes que demuestran científicamente eficacia anticaída. Sin efecto rebote, ni efectos secundarios.                              Ver más detalles ",champu
3.94,4.0,381,"NaturVital - Champú ColourSafe Cabellos Negros, Sin Parabenos ni Siliconas, Champú Colorante para Pelo Teñido o Natural, con Keratina Vegetal, Protege el Color, 300 ml Acerca de este producto                         CHAMPÚ COLOURSAFE: Con pigmento que protege y reaviva el color de los cabellos negros teñidos o naturales, aportando suavidad y un brillo más luminoso     BENEFICIOS: Su alta compatibilidad dérmica reaviva el color del cabello natural y teñido, mientras lo protege de la radiación solar gracias a su filtro UV     INGREDIENTES NATURALES: Su fórmula contiene Keratina vegetal, extracto de Girasol y jugo de Aloe Vera de agricultura biológica. Es libre de parabenos, siliconas, ftalatos, cocamide DEA y PEGs     MODO DE USO: Aplicar sobre el cabello húmedo dando un ligero masaje, dejar actuar unos minutos y enjuagar con abundante agua. No es necesario usar guantes per se recomienda lavar bien las manos tras el uso     CHAMPÚ UNISEX: Apto para hombres y mujeres con cabello natural o teñido                              Ver más detalles Descripción del productoEl Champú ColourSafe para Cabellos Negros reaviva el color del cabello natural y teñido, a la vez lo refuerza y repara. De alta compatibilidad dérmica, su fórmula protege el color del cabello negro, aportándole más brillo y suavidad. También lo protege de la radiación solar gracias a su filtro UV. Está formulado con Keratina vegetal, un compuesto de 18 aminoácidos similar a la keratina capilar. Contiene Extracto de Girasol que aporta protección al color del cabello y Jugo de Aloe Vera de agricultura biológica que proporciona la máxima hidratación. Es un champú ideal para personas que desean evitar el uso de siliconas, PEGs, Ftalatos, Cocamide DEA y parabenos. Es de fácil aplicación y enjuague: distribuir sobre el cabello húmedo dando un ligero masaje. Dejar actuar unos minutos y enjuagar con abundante agua. No es necesario usar guantes, pero se recomienda lavar cuidadosamente con jabón neutro la piel tras su uso. Su envase no contiene plástico virgen: está hecho de PET 100% reciclado, y se puede reciclar tantas veces como sea necesario. Su composición y producción hacen de este champú un producto apto para veganos. La marca NaturVital (Naturaleza y Vida) produce Energía Solar en sus propias instalaciones para abastecer la fabricación de sus productos, por lo que es un champú elaborado con energía limpia. Además, gracias a un plan de gestión de emisiones, garantiza el balance neutral de emisiones CO2.IngredientesaguadirecciónAplicar sobre el cabello húmedo dando un ligero masaje. Dejar actuar unos minutos y enjuagar con abundante agua. Proteger la piel cerca del nacimiento del cabello con crema antes de su uso. Lavar bien las manos tras el uso. No es necesario usar guantes.Contenido de la cajaChampúVer más",champu
9.49,3.8,71,"Jabón De Champú De Jengibre,barra De Champú Anticaída Del Cabello,champú Solido De Jengibre,champú Anticaspa De Jengibre,champú De Jengibre Para El Crecimiento Del Cabello Acerca de este producto                         【Ingredientes seguros】El jabón de champú está hecho de ingredientes de jengibre totalmente naturales,sin ingredientes irritantes, este champú de jengibre para el crecimiento del cabello tiene una textura refrescante y controla eficazmente el aceite para mantenerlo limpio. Nutre el cabello,fortalece las raíces y estimula el cabello mientras Mantiene el cuero cabelludo limpio y ayuda a eliminar la caspa del cabello.No causa irritación ni efectos secundarios en el cuero cabelludo ni en el cabello.     【Jabón anticaída del cabello】 Esta barra de champú de jengibre estimula la regeneración del cabello en el área del cuero cabelludo, fortaleciendo cada folículo y raíz del cabello, reduciendo visiblemente la caída del cabello y el retroceso de la línea del cabello. ayuda a equilibrar el cuero cabelludo graso, mejora la picazón del cuero cabelludo, aumenta el volumen del cabello y restaura la nutrición de los folículos pilosos.     【Nutritivo Mejora la calidad del cabello】La barra de champú ayuda a nutrir profundamente el cabello y el cuero cabelludo, mantiene el cuero cabelludo saludable, mejora el brillo del cabello y seca el cabello, humecta y reduce el encrespamiento, repara la caída y el quiebre del cabello mientras mantiene limpios los poros del cuero cabelludo, ayuda a eliminar la caspa y hace que el cabello esté saludable .Más fuerte para el crecimiento del cabello mientras mejora la textura del cabello.     【Adecuado para la multitud】La fórmula suave y eficaz del jabón de champú regenerador de jengibre ayuda a la superficie del cabello dañado, fija y brilla y controla el encrespamiento. Repara, suaviza y fortalece el cabello seco, quebradizo y encrespado. Hacen que cualquier cabello, incluso el cabello seco y tratado, se vea brillante, brillante y suave. Es adecuado para hombres, mujeres, adolescentes y otros problemas como la caída del cabello, el adelgazamiento del cabello y el retroceso .     【Fácil de usar】Hidrata tu cabello. Aplique la barra de champú para el crecimiento del cabello de jengibre directamente sobre el cabello mojado, masajee suavemente sobre el cuero cabelludo durante 2-3 minutos. Lave la espuma con agua tibia.                              Ver más detalles direcciónHidrata tu cabello. Aplique la barra de champú para el crecimiento del cabello con jengibre directamente sobre su cabello mojado, masajee suavemente sobre su cuero cabelludo durante 2-3 minutos. Lave la espuma con agua tibia.",champu
43.0,3.4,10,"Hairdreams Stop&Grow - Champú para hombre Acerca de este producto                         La fragancia y la consistencia son perfectos para hombres de verdad. Con protección solar y UV.                              Ver más detalles Descripción del productoLa pérdida de cabello hereditaria o genética es un problema grave para hombres y mujeres. La terapia anticaída del cabello con hasta un 23 % más de pelo en solo 90 días se ha desarrollado en colaboración con los principales científicos y dermatólogos. Está pendiente de patente y es una solución muy eficaz que combate la caída del cabello y promueve un nuevo crecimiento. Aplicación: se puede aplicar diariamente para lavar el cabello.direcciónAplicar el champú sobre el cabello mojado, masajear suavemente y enjuagar bien. Para maximizar el efecto de protección UV y anti-caída del cabello, use el champú regularmente.",champu
17.0,4.0,4,"Don Cabello Champu Sin Parabenos- Champú Anti-Caída Fortalece & Estimula el Crecimiento del Cabello Para Hombres y Mujeres con Romero, Canela Y Jengibre (1000 ml) Acerca de este producto                         🌿 UNA FORMULA NATURAL - ¡Revive tu cabello con nuestro anti-oxidante champú natural para cabello con romero, canela y jengibre, sin siliconas o aceites minerales, para nutrir y fortalecer tu cabello desde la raíz hasta las puntas, perfecto para revitalizar y darle un brillo radiante a tu melena.     🌿 NUTRE E HIDRATA - Disfruta del refrescante aroma de romero, jengibre y canela que perdura en tu cabello, brindándote una experiencia de spa en cada lavado. Nuestro champu sin parabenos hidrata, desenreda, repara y controla el frizz, además de aportar brillo al cabello.     🌿 FOMENTA UN CABELLO FUERTE Y SALUDABLE - No solo puede prevenir eficazmente la caída del cabello, promover su crecimiento e inhibir la producción de grasa. Su uso prolongado favorece un cabello saludable, nutre profundamente el cabello y el cuero cabelludo, y repara el cabello dañado.     🌿 PREVIENE LA CAÍDA - ¡Haz que tu cabello luzca más fuerte, saludable y lleno de vida con nuestro champú hidratante que fortalece y nutre tu cabello desde adentro, estimulando el crecimiento y previniendo la caída.     🌿 PERFECTO PARA TODO TIPO DE CABELLO - ¡Descubre el secreto para un cabello hermoso y saludable con nuestro champú para el crecimiento del cabello! Este champú está diseñado para dejar tu cabello radiante y lleno de vida, permitiéndote sentirte seguro y listo para conquistar el mundo. Es ideal para cualquier tipo de cabello, ya sea normal, graso, seco o teñido.                              Ver más detalles Descripción del producto¿Quieres descubrir el secreto para un cabello hermoso y saludable? - Nuestro innovador champú para el cuidado del cabello Don Cabello transforma el cabello seco y opaco en mechones elásticos y brillantes con su fórmula intensamente hidratante, por lo que te encantará.CHAMPÚ TODO NATURAL - Nuestro champu de anti-caída es suave pero efectivo, formulado con los mejores ingredientes naturales de alta calidad como la canela, el jengibre y el romero, que trabajan en sinergia para fortalecer tu cabello desde la raíz hasta las puntas. ELEVA EL CUIDADO DE TU CABELLO - Descubre el poder de la naturaleza con nuestro champú anticaída, formulado especialmente para combatir la pérdida de cabello. Previene eficazmente la caída del cabello, repone los nutrientes en las raíces y mejora la resistencia a los factores externos, haciendo que el cabello sea grueso y brillante.PASOS DE USO - Aplicar una cantidad generosa de champú sobre el cabello mojado. Masajear suavemente el cuero cabelludo con movimientos circulares durante unos minutos para permitir que los ingredientes activos penetren profundamente. Enjuagar bien con agua tibia. Para obtener mejores resultados, use de forma regular y complemente con nuestro acondicionador de la misma línea.Especificaciones:Cruelty Free, Sin Sulfators ni ParabenosProtégé el CabelloFortalece y nutre cada hebraEstimula el crecimiento de nuevo cabelloMejora la circulación en el cuero cabelludoMantiene el cuero cabelludo sano y libre de caspaRecomendado para todo tipo de cabello, especialmente para aquellos que buscan prevenir la caída del cabello y mejorar la salud capilar.EL PAQUETE INCLUYE1 x Champú AnticaidaRevitaliza tu cabello con nuestro Champú Anticaída de Canela, Jengibre y Romero y experimenta la diferencia de un cabello más fuerte, sano y lleno de vida.IngredientesRomeroCanelaJengibredirecciónAplicar una cantidad generosa de champú sobre el cabello mojado. Masajear suavemente el cuero cabelludo con movimientos circulares durante unos minutos. Enjuagar bien con agua tibia.Advertencia de seguridadUso ExternoVer más",champu
20.99,3.7,143,"Champú para teñir el cabello gris, negro instantáneo, natural, Champú 3 en 1 para hombres y mujeres (Chestnut) Acerca de este producto                         【SAFE & NATURAL HAIR COLOR SHAMPOO】champú de color de pelo contiene ingredientes herbales y activos para la nutrición del cabello. Ginseng, aceite de sésamo negro, Cacumen, y Gallnut hará que su cabello sedoso y saludable. Sin amoniaco, sin parabenos y sin productos químicos agresivos.     【CHAMPÚ DE COLOR PARA EL PELO GRIS】 Revertir el encanecimiento del cabello, y cubrir las canas con eficacia, que se adapta a todo tipo de cabello. Make you looks younger and no longer be annoyed by gray hair. 4 Color está disponible para la coloración del cabello oscuro, puede teñir diferente color como quieras para hacer cada día especial para usted.     【INSTANT HAIR DYE SHAMPOO】Use los guantes en el paquete, aplique el champú de tinte para el cabello sobre el cabello SECO, frote uniformemente durante 5 minutos, y manténgalo durante 10-15 minutos, luego enjuague. No es necesario mezclar de antemano y sin complicaciones para teñir el cabello en casa, super fácil y rápido de aplicar.     【3 EN 1 PRODUCTOS DE COLOR DE PELO】 A diferencia de otros tintes químicos para el cabello,este tinte limpia, tiñe y acondiciona el cabello en un solo paso,lo que vigoriza el cuero cabelludo,fortalece el cabello de la raíz a las puntas y mantiene el vigor general de su cabello.     【AHORRE DINERO Y TIEMPO】 champú para teñir el cabello para hombres y mujeres puede teñir el cabello sólo en casa,no más visitas a la peluquería.Y el color natural del cabello puede durar hasta 3-4 semanas. 500ML champú de color está disponible para alrededor de 10-15 aplicaciones,que puede la luz en su bolsillo y ahorrar tiempo.                              Ver más detalles Descripción del productoDescripción del producto100% COBERTURA DE CANAS: Puede cubrir eficazmente las canas, por lo que ya no se ven afectados por el pelo gris y rejuvenecer. Obtener de nuevo el pelo de aspecto fresco de sus días más jóvenes. El pelo negro puede durar 3-4 semanas. El champú colorante sólo se adhieren a la superficie de la cáscara del pelo, Es más seguro para su cabello, así como su piel. Introducción de parámetros 【Name]】:E Castaño【Color】:Negro /Marrón oscuro/Café/Vino rojo/Castaño/Púrpura【Specification】:500ml 【Efficacy】:Champú, cuidado del cabello, cuidado del cabello, cubrir las canas, tinte para el cabello, teñido, fijación del color, reposición del color del cabello. 【Use】:Póngase guantes para mojar el cabello, presione la cantidad adecuada de este producto en las manos y frote las burbujas, luego aplíquelo uniformemente en la cabeza, frote repetidamente y uniformemente, insista en 10-15 minutos y luego enjuague. 【Size】: 10.12 x 4.72 x 3.03 pulgadas; 1.23 Pounds。IngredientesAceite de cocodirecciónPóngase guantes para mojar el cabello, presione la cantidad adecuada de este producto en las manos y frote las burbujas, luego aplíquelo uniformemente en la cabeza, frote repetidamente y uniformemente, insista en 10-15 minutos y luego enjuague.Advertencia de seguridadApply evenly and avoid contact with eyesVer más",champu
12.59,4.2,191,"Champú Romero 300 ML Romero Champú Anticaida Natural Champú pelo Graso para Fortalece y Estimula el Crecimiento del Cabello Reparación y Volumen Acerca de este producto                         ★ El champú fortalecedor de romero proporciona hidratación intensa para todo tipo de cabello con una fórmula suave que nutre y ayuda a fortalecer el cabello débil y quebradizo.     ★ Limpia suavemente y protege el cabello, El champú para el cuero cabelludo con romero puede purificar y nutrir eficazmente la raíz del cabello y los poros obstruidos del cuero cabelludo.     ★ Champú de romero Con aceite de romero orgánico ayudará a calmar el cuero cabelludo escamoso y con picazón y estimulará los sentidos. La fragancia de romero mima tus sentidos con cada lavado del cabello     ★ El champú de romero para el cabello puede mejorar la textura, la plenitud y la fuerza del cabello tanto para mujeres como para hombres, promueve el crecimiento y la fuerza del cabello.     ★ Champú de Romero Proporciona una hidratación intensa para todo tipo de cabello junto con un deslizamiento inigualable. Recomendamos usar un acondicionador después de cada lavado de cabello para cerrar los mechones de cabello y añadir humedad adicional al cabello.                              Ver más detalles Descripción del producto🌿🌿🌿¡Ya no te preocupes por el adelgazamiento del cabello y la calvicie! La aplicación regular dejará tu cabello visiblemente más voluminoso, brillante y flexible.Promueva el crecimiento del cabello con esta eficaz fórmula sin enjuague, que brinda poderosos ingredientes a las raíces de su cabello. Perfecto para cabello fino o de crecimiento lento.Desintoxicar el cuero cabelludo, mantener el nivel de aceite del cabello. Revive el cuero cabelludo y los folículos para evitar un mayor adelgazamiento mientras promueve el crecimiento de cabello nuevo y más grueso.🌿🌿🌿Cómo utilizar:Moja bien tu cabelloAplicar la barra de champú en el cuero cabelludo.Masajea la espuma en tu cabello.Enjuaga muy bien el shampoodirección1. Moja bien tu cabello. 2. Aplica la barra de champú en el cuero cabelludo. 3. Masajea la espuma en tu cabello. 4. Enjuaga muy bien el shampoo.Advertencia de seguridadEvita el contacto visual. Almacenar en un lugar fresco y seco, lejos de la luz solar directa. Mantener fuera del alcance de los niños.Ver más",champu
24.32,3.9,3,"Champú Terapéutico 500ml Tratamiento Para Psoriasis Capilar, Eccemas, Descamación y Picazón del Cuero Cabelludo, Combate el Exceso de Grasa - Healpsorin Acerca de este producto                         Ayuda con la picazón y la formación de caspa. Formulado para prevenir la recurrencia de picazón y descamación en el cuero cabelludo asociados con psoriasis, dermatitis seborreica y caspa.     HIDRATIZA LA CUELLO CABEZA Y EL CABELLO - Obtén el cabello sedoso, brillante y saludable que siempre has querido. El champú Healpsorin elimina suavemente los depósitos del cabello.     SUSTANCIAS ACTIVAS - Dermosoft Decalact es un agente natural y multifuncional con propiedades antimicrobianas y antifúngicas. Puede ayudar contra los microorganismos que causan enfermedades de la piel como caspa, dermatitis seborreica y psoriasis. El ácido salicílico elimina la caspa que aparece en las manchas de psoriasis.     Champú médico: masajee el producto en el cuero cabelludo, déjelo actuar durante al menos 3 a 7 minutos y luego enjuague. Es posible que deba usar champú Healpsorin repetidamente para controlar las lesiones. A menudo, esto significa usar el champú diariamente durante varias semanas. Una vez que tenga sus lesiones bajo control, puede reducir el uso del producto a solo dos veces por semana.     ACEITES ESENCIALES - El champú Healpsorin está hecho a base de aceites y extractos naturales y se puede absorber rápidamente en la piel para lograr un alivio y tratamiento graduales.                              Ver más detalles Descripción del productoChampú Healpsorin psoriasisIngredientesAqua, cocamidopropilbetaína, cocoilsarcosinato de sodio, acrilato/copolímero de metacrilato Beheneth-25, urea, ácido salicílico, polisorbato-20, perfume, caprodil sódilo/lauroillato, citrato de trietilo, aceite de semilla Helianthus Annuus (girasol), Symphytum officincin. Extracto de hoja ale, Citrus Aurantium Amara Aceite de Flores, Aceite de Cablin Pogostemon, Cianocobalamina, Limoneno, Linalool.dirección1 unidad. Humedezca el cabello y masajee el cuero cabelludo con champú. 2. Dejar actuar durante un par de minutos para permitir que el producto penetre en la piel. 3. Aclarar a fondo. Para obtener los mejores resultados, use al menos dos veces por semana.Advertencia de seguridadSolo para uso externo. Al usar este producto, evite el contacto con los ojos. En caso de contacto, enjuague bien los ojos con agua. Mantener fuera del alcance de los niños. En caso de ingestión, busque ayuda médica. Deje de usar y consulte a un médico si la condición empeora o no mejora después del uso regular. Consulte a un médico antes de usar si tiene una afección que cubre una gran parte del cuerpo.Ver más",champu
24.6,4.0,26,"250 ml - Champú Anticaída Unisex Alopecia Androgénica 100% Natural con Menta y Cebolla | Shampoo Densificador | Crecimiento Cabello Mujer y Hombre | Anti Caspa y Probado para Dermatitis Seborreíca Acerca de este producto                         💆🏻‍♂️ Prevención de la Pérdida de Cabello: Respaldado por investigaciones, nuestro champú anticaída ayuda en la prevención de la caída del cabello en mujer y hombre, con una eficacia demostrada en estudios que comparan la menta con productos químicos. El mejor anticaída cabello mujer y hombre del mercado. Tratamiento esencial crece pelo hombre y mujer.     🧬 Eficacia Científica Comprobada: Nuestro champú anticaída está formulado con una combinación única a base de aceite de menta, romero, aguacate, extractos de propóleos, aloe vera, cebolla, etc., para nutrir y promover el crecimiento natural del cabello, fortaleciéndolo desde la raíz. Una combinación de principios activos 100% naturales que combaten las principales causas de la caída del cabello en mujer o hombre.     🚿 Estimulación Durante el Lavado: El champú de SIIL estimula las raíces del cabello durante el lavado, penetrando en los folículos pilosos en segundos, para fortalecer el cabello fino y debilitado. Este champú anticaída hombre y mujer acelera el crecimiento del cabello, disminuyendo su pérdida y regulando el exceso de grasa.     🚫 Sin Siliconas ni Parabenos: Nuestro champú anticaída está formulado sin siliconas, suavizantes, parabenos ni otros químicos dañinos para tu salud. Su fórmula facilita el peinado sin dejar residuos en el cuero cabelludo. Formulado con aceites de jojoba, aguacate, romero, cedro, menta y cebolla, limpia e hidrata profundamente, cuidando la piel del cuero cabelludo.     ✅ Resultados Notables: Puedes ver mejoras significativas en la reducción de la pérdida de cabello en tan solo 3 meses de uso regular, convirtiéndolo en un elemento esencial en la rutina de cuidado del cabello. Champú crece pelo rápido mujer y hombre. Formulado y fabricado en España con la mejor fórmula y garantía 100%. Mejora la caspa y la dermatitis seborreíca. Apto para adultos y adolescentes.                              Ver más detalles ",champu
21.99,5.0,1,"Pemarlis 3 en 1 Instantáneo Champú para el Cabello Negro,Champú colorante para cabello gris,color negro,fácil de usar,Inmediato Champú colorante para el cabello para hombres y mujeres,500ML Acerca de este producto                         【Cuidado nutritivo del cabello】Nuestro champú natural para cabello negro contiene ginseng, aceite de sésamo negro y otros ingredientes activos herbales nutritivos para el cabello que no solo tiñen su cabello, sino que también cuidan su cuero cabelludo y reparan el cabello dañado     【3-en-1 champú para teñir el cabello】Nuestro champú para teñir el cabello se puede utilizar no sólo como un tinte para el cabello, sino también como un champú y acondicionador, ¡simplemente tiña su cabello mientras se lava con champú!     【Fácil de usar】No necesita cepillarse, solo use guantes y aplíquelo sobre el cabello seco como lo haría con un champú normal, espere de 10 a 15 minutos y luego enjuáguelo.     【Cubre las canas】No importa qué tipo de cabello tengas, incluyendo cabello grueso, cabello fino, cabello de densidad normal, cabello liso o rizado, puedes usarlo, especialmente adecuado para cabello blanco, cabello gris, cabello de color de cabello desigual, cubre eficazmente el cabello blanco.     【Coloración de larga duración】El color natural del cabello negro dura más de 30 días hasta que aparezca el cabello blanco, el champú al mismo tiempo le da un cabello natural oscuro y brillante.                              Ver más detalles dirección1. Usar guantes. 2. Aplicar sobre el cabello seco como un champú ordinario. 3. Espere de 10 a 15 minutos. 4. Enjuagar.Advertencia de seguridadno",champu
