Price,Star_Rating,Reviews,Product_Description,Tipo
13.95,4.4,608,"Bali Soap - Juego de regalo de barra de jabón natural, jabón facial o corporal, ideal para todo tipo de piel, para mujeres, hombres y adolescentes, paquete de 3 jabones variados 3.5 oz cada uno Acerca de este producto                         JABÓN NATURAL EXÓTICO DE BALI: barras de larga duración que se enjuagan y no dejan residuos de jabón. La glicerina natural promueve una hidratación adicional que ayuda a prevenir la piel seca.     TEXTURIZADO CON BOTÁNICOS NATURALES DE LA ISLA - Una mezcla exótica de ingredientes orgánicos que da como resultado un exfoliante vigorizante combinado con una espuma cremosa.     VARIEDAD / PAQUETE DE REGALO: 3 barras envueltas individualmente en una elegante caja de regalo perfecta para su hogar, regalos de boda, regalos de oficina, despedidas de soltera, graduación o prácticamente cualquier ocasión de obsequio.     GARANTÍA DE SATISFACCIÓN 100%: todos tienen sus propios gustos, sentidos y preferencias personales, y está bien, así que si por alguna razón no está satisfecho con nuestros jabones, puede devolverlos para obtener un reembolso completo.     Nunca probado en animales                              Ver más detalles ",jabon
15.99,4.2,751,"SatinNaturel Set Champú y acondicionador solido - 100% Organico: Sin Jabon, siliconas o parabenos - Espuma extra para todos los tipos de cabellos - Hidratación & Brillo - Regalo Mujer y hombre Acerca de este producto                         ⭐️CUIDADO SUAVE PARA EL CABELLO: las barras de champú orgánicas cuidan el cuero cabelludo con especial delicadeza y lo protegen de la desecación mediante espuma extra y aceites de alta calidad. La fórmula de cuidado única y rica protege el cabello, le da volumen y brillo y es el cuidado hidratante óptimo para el cabello seco. Como tratamiento capilar, el champú con aceite de argan organico cuida el cabello graso y el cabello seco y es adecuado para todo tipo de cabellos.     ❤️SOSTENIBLE Y PRÁCTICO: las barras de champú ofrecen numerosas ventajas sobre un champú convencional: Ahorran increíblemente espacio, caben en todas partes y, por lo tanto, siempre están contigo. Son mucho más económicos que los champús convencionales y duran unas 3 veces más. Además, nuestras barras de champú hacen una declaración de productos sostenibles al evitar por completo el plástico y los conservantes con una caja plegable fácilmente reciclable.     🌿ACEITE DE ARGÁN Y MADERA DE CEDRO PARA UNA HIDRATACIÓN, BRILLO Y RECONSTRUCCIÓN EFICIENTE: nuestras barras orgánicas no solo cuidan el cuero cabelludo y el cabello seco como un champú. Su exclusiva formulación vegana, sin sulfatos ni parabenos, hidrata y nutre el cabello en profundidad y es completamente adequada para todo tipo de cabello, siendo perfecta para tratar cabellos finos, de color claro y para el cabello con daño termico/de calor o cabellos dañados por química.     🍃CUIDADO DE LA PIEL EN EXCELENTE CALIDAD ORGÁNICA - Los cosméticos naturales Satin Naturel son producidos con los más altos estándares de calidad y están testados dermatológicamente. Nuestros productos de belleza se centran en la eficacia natural con ingredientes orgánicos, son veganos y están fabricados según los estándares de Clean Beauty sin aditivos nocivos como microplásticos, parabenos, siliconas o aceites minerales. Nuestro champú es pH piel neutro y 100% libre de jabón.     ✅ESTAMOS AQUÍ PARA AYUDARLE: ¡Nos sentimos satisfechos sólo si tú lo estás! Si el producto no cumple con tus expectativas, no dudes en ponerte en contacto con nosotros. Estarás satisfecho o reembolsado.                              Ver más detalles ",jabon
30.99,4.2,16,"Störtebekker® Premium Champú sólido Citrus (x3) - Champú vegano hecho a mano para hombre y mujer - cuidado de ducha perfumado para la piel y el cabello - Champú hidratante sólido - Champú Bar Acerca de este producto                         ✓ LIMPIEZA SUAVE Y BÁSICA: los ingredientes altamente nutritivos del champú para cabello sólido limpian el cabello intensamente y lo hacen fácil de peinar y no graso. Perfecto también para cuero cabelludo seco.     ✓ TAMAÑO PRÁCTICO: gracias al tamaño práctico y al diseño cuadrado, nuestro champú para el cabello fijo es ideal para viajes y viajes.     ✓ FÁCIL DE USAR: aplique el jabón de ducha directamente en el cuero cabelludo al ducharse o hacer espuma entre las manos y luego masajear en el cabello. Enjuaga bien el cabello.     ✓ MAGNIFICO FRAGRANCIA: el champú Störtebekker en la fragancia Citrus se basa en agradables aromas naturales y recuerda a los cítricos frescos y el verano. Las maravillosas notas frescas de nuestro jabón para el cabello son beneficiosas y vigorizantes.     ✓ HECHO A MANO: nuestro champú sólido sin sulfatos parabenos y siliconas se fabrica a mano en una fábrica de jabón en Holanda y está empaquetado sin plástico.                              Ver más detalles ",jabon
13.59,4.8,46,"Evyap Jabón de afeitar en barra de 75 g, 6 unidades, perfume fantástico, potente y de larga duración, para hombres, paquete tradicional Acerca de este producto                         Estos jabones hacen espuma fácil y rápidamente. Crea una espuma muy gruesa y lubricante     Aroma fantástico, potente y duradero     Embalaje muy tradicional, solo para hombres que aman el afeitado tradicional     Proporciona un afeitado apurado y suave     Deja la piel muy suave y flexible                              Ver más detalles Descripción del productoArko - Jabón en crema de afeitar (6 piezas)IngredientesJABÓNdirección1 unidad. Derrita suavemente el jabón de afeitar sobre la piel húmeda. 2. Crea una espuma gruesa y lubricante masajeando suavemente.Ver más",jabon
15.7,4.7,626,"Old Spice Captain Gel De Ducha Y Champú Para Hombres 2x1000ml, Gel Para Cara, Cuerpo Y Pelo 3 En 1 Multiusos, Frescura Duradera, Fragancia Excepcional, Limpieza Profunda Acerca de este producto                         DA LA BIENVENIDA A UNA FRESCURA DURADERA CON FRAGANCIA EXCEPCIONAL: Con la tecnología de limpieza profunda y los aromas excepcionales del gel de ducha y champú Old Spice, disfruta de frescura en todo el cuerpo     PRUEBA EL EXCEPCIONAL AROMA DE OLD SPICE CAPTAIN: La fragancia de las feroces olas del océano, madera de sándalo y ácida bergamota te transformará en el intrépido capitán de la frescura     LIMPIEZA PROFUNDA Y SENSACIÓN DE SUAVIDAD EN LA PIEL. ¡Disfruta aún más de la ducha! El gel de ducha 3 en 1 no sólo elimina los malos olores, sino que también deja la piel suave y tersa     LIMPIA TODO: CUERPO, PELO, CARA con Old Spice, nuestro gel de ducha para hombres que ahorra tiempo y es perfecto para llevar en la maleta     REVITALIZA LA FRESCURA CON el envase EXTRA XL de 1 litro. Más días de frescor duradero con un aroma extraordinario, y un práctico dispensador muy fácil de usar                              Ver más detalles Descripción del productoDisfruta de un frescor duradero y un aroma excepcional con el gel y champú Old Spice Captain para hombres. Gracias a su fórmula de limpieza profunda y a sus aromas de calidad, elimina la suciedad y el mal olor para dejarte limpio y fresco. Esta fórmula 3 en 1 actúa en el cabello, el rostro y el cuerpo, y deja la piel con una sensación increíblemente suave para que puedas centrarte en actividades más importantes, como cerrar tratos o enseñar a hablar a los delfines. La excepcional fragancia de las feroces olas del océano, madera de sándalo y ácida bergamota te transformará en el intrépido capitán de la frescura en una aventura salvaje a través de los siete mares.IngredientesAqua, Sodium Lauryl Sulfate, Cocamidopropyl Betaine, Sodium Chloride, Parfum, Benzyl Alcohol, Sodium Benzoate, Sodium Citrate, Sodium Xylenesulfonate, Sodium Salicylate, Citric Acid, Linalool, Disodium EDTA, Sodium Hydroxide, Hexyl Cinnamal, Citronellol, CI 42090, CI 17200dirección1. Aplique el producto en el cuerpo, el cabello y el rostro. 2. Haga espuma con el producto. 3. Enjuague la espuma.Ver más",jabon
10.59,5.0,1,"2Piezas Esponja de Jabón de Baño 2 en 1,Esponja de Lufa Envuelta con Cordón,Esponja de Lufa Exfoliante,Esponja de Baño Rica en Espuma,Para Hombres y Mujeres,Productos de Baño,Piel Limpia Acerca de este producto                         Diseño 2 en 1: esta esponja de jabón de baño 2 en 1 tiene un diseño único 2 en 1, un lado es de malla suave para una limpieza delicada; el otro lado es de rizo suave para una exfoliación profunda, fácil y cómodo de usar.     Material de calidad: la esponja de jabón de baño 2 en 1 está hecha de rizo exfoliante y material de polietileno, esta combinación de materiales puede prevenir eficazmente el crecimiento bacteriano y el olor. El diseño de malla es suave y delicado y no raya la piel, asegurando seguridad y comodidad en uso.     Fácil de usar: esta toalla de baño de lufa está diseñada con un cordón, lo que hace que sea fácil ajustar el tamaño de la toalla, y también es fácil de colgar y secar después de su uso. Cuando lo utilices, simplemente coloca el jabón en la toalla de baño, tira suavemente de la cuerda para envolver el jabón, muy conveniente.     Espuma rica: el exfoliante corporal de lufa está hecho de material de malla ultrafina, esponjoso y duradero, buen efecto espumoso. La espuma producida es más delicada y densa que las flores de baño normales. El jabón se puede colocar dentro de la esponja de baño de lufa, lo que te permite mantener una rica espuma durante todo el proceso de baño, proporcionando una experiencia cómoda y agradable.     Amplia aplicación: este limpiador de baño corporal de lufa es adecuado tanto para adultos como para niños, se puede utilizar para la cara y el cuerpo, adecuado para todo tipo de piel. Es portátil y fácil de almacenar, ideal para viajar.                              Ver más detalles Material: polietileno, tela de rizo. Color: blanco, verde. El paquete incluye: 2 esponjas de jabón de baño 2 en 1.",jabon
16.0,4.6,737,Pears Soft & Fresh Jabón líquido para manos con 10 veces más de hidratación* 250ml (3 Pack)  ,jabon
3.5,4.4,73,"Pardo Jabón Natural - 200 g - Pastilla de jabón sólido de 200 gr Pardo Vintage ‘Casa en la Alcarria – Verbena y Toscana’ Acerca de este producto                         Jabón natural elaborado tradicionalmente en caldera por maestros jaboneros     Formulación vegana. Testado dermatológicamente y apto para todo tipo de pieles.     Produce una espuma aterciopelada, lujosa y fragante que convierte la higiene diaria en un placer para los sentidos y deja la piel limpia y delicadamente perfumada.     Formato en pastilla y empaquetado sin plásticos, la opción más sostenible y respetuosa con el medio ambiente.     La colección Pardo Vintage es un viaje sensorial por algunos de los lugares más bellos de España inspirado en Basilia Escarpa, fundadora de la marca Pardo en 1927.                              Ver más detalles Descripción del productoPastilla de jabón sólido de 200 gr Pardo Vintage ‘Casa en la Alcarria – Verbena y Toscana’. Elaborado artesanalmente a base de ingredientes naturales. Testado dermatológicamente y apto para todo tipo de pieles. Vegano y cruelty free.Advertencia de seguridadSolo para uso externo",jabon
21.5,5.0,3,"IDIKÖ Champú Anticaída Hombre y Mujer 250ml, Estimula el Crecimiento del Cabello, Shampoo Anticaída para el Pelo, Normaliza el Ciclo de Crecimiento Capilar, Champú Profesional de Peluquería Acerca de este producto                         Frena la caída del cabello y estimula su crecimiento: Champú anticaída que fortalece la fibra capilar desde la raíz, ayudando a reducir la caída prematura y promoviendo un cabello más fuerte y saludable.     Fórmula con Keratina Hidrolizada y Extractos Vegetales: Su combinación de tusílago, milenrama y quina normaliza el ciclo de crecimiento capilar y mejora el intercambio de nutrientes entre la raíz y el cuero cabelludo.     Enriquecido con Vitaminas B5 y B6: Nutre y revitaliza el cabello, aportándole resistencia, brillo y elasticidad para un aspecto más saludable. Indicado para uso personal y profesional.     Fácil aplicación y uso diario: Aplica sobre el cabello mojado, masajea hasta hacer espuma y enjuaga. Para mejores resultados, deja actuar unos minutos en la segunda aplicación.     Para mujeres y hombres: Diseñado para combatir la caída del pelo en todo tipo de cabellos frágiles, quebradizos o con tendencia a la pérdida prematura.     Formato de 250 ml: Cantidad ideal para un tratamiento efectivo y duradero, perfecto para incluir en tu rutina capilar diaria.                              Ver más detalles Descripción del productoEl Champú Anticaída de IDIKÖ es la solución ideal para hombres y mujeres que buscan frenar la caída del cabello y estimular su crecimiento. Su fórmula con Keratina Hidrolizada y extractos vegetales de tusílago, milenrama y quina fortalece la fibra capilar desde la raíz, ayudando a reducir la caída prematura y promoviendo un cabello más fuerte y saludable. Enriquecido con Vitaminas B5 y B6, nutre y revitaliza, aportando resistencia, brillo y elasticidad. Perfecto para cabellos frágiles, quebradizos y con tendencia a la caída, este champú anticaída mejora el ciclo de crecimiento capilar y optimiza los intercambios metabólicos del cuero cabelludo. Su uso regular favorece un crecimiento del cabello más rápido y saludable. Su formato de 250 ml ofrece un tratamiento eficaz y duradero. Fácil de aplicar, solo necesitas masajear sobre el cabello mojado hasta hacer espuma y enjuagar, repitiendo la aplicación para mejores resultados. Apto para todo tipo de cabellos.IngredientesAqua(Water), Sodium Laureth Sulfate, Cocamide Dea, Glycerin, Cocamidopropyl Betaine, Sodium Chloride, Hydrolyzed Keratin, Guar Hydroxypropyltrimonium Chloride, Parfum(Fragance), Disodium EDTA, Sodium Benzoate, Diazolidinyl Urea, Cichona Succirubra Bark Extract(Cinchona Succirubra (Quinine) Bark Extract), Tussilago Farfara Flower/Leaf Extract(Tussilago Farfara(Coltsfoott) Flower/Leaf Extract), Achillea Millefolium Extract(Achillea Millefolium (Yarrow) Extract), Potassium Sorbate, Polyquaternium-7, Citric Acid, Lactic Acid, Calcium Pantothenate, Pyridoxine HCL, PEG-40 Hydrogenated Castor Oil, Alcohol Denat, Styrene/Acrylates Copolymer, Coco-Glucoside.",jabon
14.94,4.4,477,"CETAPHIL Crema Hidratante Facial PRO OIL Control, para pieles grasas con tendencia acnéica, con protección solar FPS 30, 118ML Acerca de este producto                         Hidrata la piel y aporta una alta protección de los rayos uva/uvb (fps30)     Hidrata de forma rápida y duradera     Regula el exceso de grasa     No obstruye los poros, hipoalergénico y sin perfume                              Ver más detalles Descripción del productoCetaphil PRO Oil Control FPS 30, aporta hidratación inmediata y duradera, reparando la barrera cutánea de las pieles grasas o con tendencia acneica. Hidrata la piel y protege de los rayos uva y uvb.direcciónConsulta el embalaje:Advertencia de seguridadLeer envaseVer más",jabon
10.9,4.0,1,"Écrin de Fleur – Jabón de Karité, para Pieles Secas, Jabón Artesanal Orgánico, Saponificado en Frío, 1x90g Acerca de este producto                         Elaborado con solo 3 ingredientes simples: manteca de karité saponificada, aceite de coco saponificado, aceite de oliva saponificado. Enriquecido con manteca de karité.     Con un 40 % de manteca de karité, es adecuado para pieles secas y sensibles. Sin olor, sin aceites esenciales, perfecto para toda la familia, incluyendo niños a partir de 3 años.     Hecho en Francia, saponificado en frío, secado naturalmente durante 30 días para preservar los beneficios de los ingredientes orgánicos.     Jabón sólido orgánico, sin aceite de palma, estabilizantes, antioxidantes, agentes PEG, sulfatos, parabenos o productos petroquímicos. Vegano y no probado en animales. Respetuoso con la piel y el medio ambiente.     Certificado Cosmos Organic por Ecocert. Envase certificado FSC, sin película de plástico, 100% biodegradable.                              Ver más detalles ",jabon
17.99,4.3,21,"MYHIXEL - Gel Intimo Hombre I Gel Intimo Masculino para Higiene y Protección | Jabón Intimo Hombre pH Balanceado Sin Sulfatos | Ayuda a Prevenir Infecciones | Fragancia Agradable para Diario I 200ml Acerca de este producto                         🌿 Higiene Intima Hombre Especializada: MYHIXEL Gel Intimo Hombre está formulado para ofrecer la mejor limpieza íntima diaria. A diferencia de un gel de ducha estándar, respeta el pH natural y ayuda a evitar molestias o irritaciones, manteniendo la zona íntima fresca, limpia y protegida. Ideal para hombres que buscan una higiene intima hombre de alto nivel.     🧴 Fórmula Delicada con Ingredientes Naturales: MYHIXEL combina ingredientes que cuidan y limpian la piel sensible sin efectos adversos. Este gel intimo masculino proporciona frescura y suavidad mientras ayuda a prevenir infecciones comunes. Perfecto para la higiene diaria, aporta confianza y protección con cada uso en tu rutina.     💧 Protección Contra Irritaciones e Infecciones: El jabon intimo hombre de MYHIXEL está formulado para cuidar la piel y evitar irritaciones que otros geles para hombre pueden provocar. Diseñado para las necesidades específicas de higiene intima hombre, su fórmula avanzada previene infecciones y promueve la salud de las zonas íntimas sensibles en cada aplicación.     👃 Aroma Refrescante y Duradero para Zonas Íntimas: Este gel intimo hombre no solo ofrece limpieza, sino una fragancia única, masculina y duradera, ideal para usar antes y después de la actividad sexual. Este gel intimo masculino es perfecto para mantener una sensación de frescura prolongada, cuidando la higiene y el confort sin incomodidad.     🛡️ Mantiene la Piel Suave y Saludable: MYHIXEL no solo limpia, sino que actúa como protector de infecciones comunes, protegiendo la piel de la sequedad y dejando una textura suave y rejuvenecida preveniendo la irritación. Perfecto como jabon intimo hombre, mantiene la salud de la piel y es ideal para quienes buscan un cuidado completo de las zonas más sensibles.                              Ver más detalles ",jabon
17.99,4.5,58,Störtebekker® Premium Beard Soap Sándalo - Champú sólido para el cuidado diario de la barba - Jabón hecho a mano para una espuma abundante - Jabón de barba vegano champú de barba (80g (1 pc.)) Acerca de este producto                         Cuidados suaves. Adecuado para todo tipo de barbas y pieles                              Ver más detalles  90 g ASIN B0BJ32TNL4,jabon
5.25,4.6,788,"Dicora Urban Fit Jabón de Manos Vitamina B Almendras & Nueces 500 ml (Paquete de 3) Acerca de este producto                         La siguiente información se aplica a cada unidad del paquete     Jabón de manos nutritivo con esencia exquisita de nueces y leche de almendras.     Cuidado extra hidratante para una piel en forma.     La vitamina B ayuda a conseguir un alto rendimiento a lo largo del día y es idónea para afrontar una actividad física.     Extractos naturales: nueces y almendras     CrueltyFree                              Ver más detalles Descripción del productoDicora Urban Fit Jabón de Manos Vitamina B es nutritivo con una esencia exquisita de nueces y leche de almendras. Cuidado extra hidratante para una piel en forma. La vitamina B ayuda a lograr un alto rendimiento durante todo el día y es ideal para lidiar con una actividad física intensa. Mejora la circulación celular y la elasticidad de la piel. 500ml.IngredientesAqua, Sodium Laureth Sulfate, Cocamidopropyl Betaine, Sodium Chloride, Disodium Cocoamphodiacetate, Glycerin, Coco Glucoside, Glyceryl Oleate, Prunus Amygdalus Dulcis Fruit Extract, Prunus Amygdalus Dulcis Oil, Juglans Regia Shell Extract, Glyceryl Stearate, PEG-60 Hydrogenated Castor Oil, Faex Extract, Niacinamide, Panthenol, Riboflavin, Inositol, Thiamine HCl, Piridoxine HCl, Biotin, Cyanocobalamin, Propylene Glycol, Parfum, Linalool, Hexyl Cinnamal, Polyquaternium-7, Tetrasodium EDTA, Styrene/Acrylates Copolymer, Benzyl Alcohol, Phenoxyethanol, Methylchloroisothiazolinone, Methylisothiazolinone, BHT, Sodium Benzoate, Potassium Sorbate, Propanediol.",jabon
4.93,4.6,42,"NIVEA Derma Skin Gel Exfoliante (1 x 150 ml), exfoliante facial y corporal anti puntos negros para pieles grasas y mixtas, gel limpiador con ácido salicílico y sal marina Acerca de este producto                         Limpieza profunda - Este gel exfoliante facial y corporal limpia en profundidad y desobstruye los poros, para conseguir una piel más uniforme en tan solo 7 días     Acción anti acné - Enriquecido con ácido salicílico, niacinamida y sal marina, el exfoliante corporal elimina los puntos negros y los granos sin resecar la piel     Dermatológicamente comprobado* - Se recomienda utilizar el gel limpiador facial exfoliante para pieles con tendencia a las imperfecciones 2 o 3 veces a la semana     Rutina de skincare - Recupera el control de tu piel y descubre toda la rutina de Derma Skin Clear: Gel Limpiador, Tónico, Exfoliante de Noche y Exfoliante     Contenido del envío: NIVEA Derma Skin Gel Exfoliante, jabón facial y para el cuerpo que elimina y previene la aparición de imperfecciones, exfoliante para pieles grasas y mixtas, 1 x 150 ml                              Ver más detalles Descripción del productoNivea Derma Skin Clear Gel Exfoliante - Recupera el control de tu piel¿Piel propensa a granos, espinillas, con poros obstruidos y exceso de sebo? Recupera el control de tu piel con el nuevo limpiador facial NIVEA Derma Skin Clear para pieles con tendencia a imperfecciones.El gel Nivea exfoliante reduce los granos y las espinillas, limpia los poros y unifica la textura de la piel, con resultados visibles en tan solo 7 días. Este jabón exfoliante apto para rostro y cuerpo reduce y previene eficazmente la reaparición de imperfecciones y no reseca la piel, gracias a su fórmula con ingredientes activos. Enriquecido con Ácido Salicílico, que limpia los poros de impurezas, exfolia y favorece el proceso natural de renovación celular; Sal Marina purificante, y Niacinamida, que tiene un efecto antiinflamatorio y calmante, actúa sobre la piel sin resecarla.Ventajas del producto:Limpia y desobstruye los porosElimina los puntos negros y los granosApto para la cara y el cuerpoNo reseca la pielCon ácido salicílico, sal marina y niacinamidaPara pieles con imperfeccionesFórmula clínicamente probada**Dermatológicamente comprobado*Fórmula vegana***Fórmula 99% biodegradable*Compatibilidad con la piel dermatológicamente comprobada**Eficacia en pieles con imperfecciones comprobada en estudios clínicos***Sin ingredientes de origen animaldirecciónPrepara tu piel limpiándola y secándola suavemente. Aplica el gel exfoliante NIVEA Derma Skin en la cara cuerpo con movimientos circulares, evitando las áreas sensibles. Utiliza 2 o 3 veces por semana, según necesidades de piel. Deja actuar durante unos minutos antes enjuagar agua tibia. Después del uso, aplica resto rutina cuidado Clear.Advertencia de seguridadSolo para uso externo. Evitar el contacto con los ojos. Mantener alejado del fuego o de fuentes de calor directas.Ver más",jabon
